<?xml version="1.0" encoding="UTF-8"?>
<!-- 
  Copyright (c) 2013, 2014 Sacred Scripture Foundation.
  "All scripture is given by inspiration of God, and is profitable for 
  doctrine, for reproof, for correction, for instruction in righteousness:
  That the man of God may be perfect, throughly furnished unto all good 
  works." (2 Tim 3:16-17)
  
  Licensed under the Apache License, Version 2.0 (the "License");
  you may not use this file except in compliance with the License.
  You may obtain a copy of the License at

      http://www.apache.org/licenses/LICENSE-2.0

  Unless required by applicable law or agreed to in writing, software
  distributed under the License is distributed on an "AS IS" BASIS,
  WITHOUT WARRANTIES OR CONDITIONS OF ANY KIND, either express or implied.
  See the License for the specific language governing permissions and
  limitations under the License.
-->
<schema 
  xmlns="http://www.w3.org/2001/XMLSchema" 
  targetNamespace="http://www.sacredscripturefoundation.org/schema/nls" 
  xmlns:nls="http://www.sacredscripturefoundation.org/schema/nls"
  xmlns:bible="http://www.sacredscripturefoundation.org/schema/bible"
  elementFormDefault="qualified"
  attributeFormDefault="unqualified" 
  version="1.0">

  <import namespace="http://www.sacredscripturefoundation.org/schema/bible" schemaLocation="http://www.sacredscripturefoundation.org/schema/bible-1.0.xsd" />

  <element name="nls">
    <complexType>
      <sequence>
        <element name="group" type="nls:GroupType" maxOccurs="unbounded">
          <unique name="UniqueGroupLocalization">
            <selector xpath="nls:localization" />
            <field xpath="@lang" />
          </unique>
        </element>
        <element name="book" type="nls:BookType" minOccurs="73" maxOccurs="73">
          <unique name="UniqueBookLocalization">
            <selector xpath="nls:localization" />
            <field xpath="@lang" />
          </unique>
        </element>
      </sequence>
    </complexType>
  </element>

  <complexType name="BookType">
    <sequence>
      <element name="localization" type="nls:BookTypeLocalization" maxOccurs="unbounded" />
    </sequence>
    <attribute name="code" type="bible:BookCodeType" use="required" />    
  </complexType>

  <complexType name="BookTypeLocalization">
    <attribute name="lang" type="language" use="required" />
    <attribute name="name" type="string" use="required" />
    <attribute name="title" type="string" use="required" />
    <attribute name="abbreviations" type="string" use="required" />
  </complexType>

  <complexType name="GroupType">
    <sequence>
      <element name="localization" type="nls:GroupLocalizationType" maxOccurs="unbounded" />
    </sequence>
    <attribute name="code" type="string" use="required" />
  </complexType>
  
  <complexType name="GroupLocalizationType">
    <attribute name="lang" type="language" use="required" />
    <attribute name="name" type="string" use="required" />
  </complexType>

</schema>